{"channel":"stable","components":[{"artifact":{"digest":"sha256:878e36323e37b29d97a188c02257283c3dc322c60755d57dc9017259f8ac386e","qualification":"https://github.com/pcvantol/engineering-platform/releases/download/engineering-platform-v2.3.113/engineering-platform-release-complete-2.3.113-9318636060706534635954e9131e42e2f63928ef.json","source":"https://files.pythonhosted.org/packages/64/ad/68ff62b7d0e6e64249f2f45e59941b2d4e67cf4448017aab0fa39c458204/engineering_platform-2.3.113-py3-none-any.whl","source_revision":"9318636060706534635954e9131e42e2f63928ef","version":"2.3.113"},"identity":"engineering-platform-server","python_runtime_qualification":{"build_evidence":{"digest":"sha256:84245721dc4989a595074eb6202d4d2b30d414921ced48908d3ec926389515fa","url":"https://autonomous-engineering-system.github.io/forge-platform/managed-tools/v1/python-3.14.7-arm64/build-provenance.json"},"runtime_identity_digest":"sha256:519d7975f16e78f808403188b3a8417bab10af000208ef1ec82c42bccfa94ceb","test_evidence":{"digest":"sha256:47f917cc24cb2bda393b2e0c997fe5a5c02a8f3eb0fe316b5dd035b43ab86a70","url":"https://github.com/autonomous-engineering-system/forge-platform/releases/download/forge-platform-product-managed-python-evidence-v3/product-managed-python-evidence.json"}},"role":"server","service":{"domain":"system","kind":"LaunchDaemon","manager":"launchd","product_service_reference":"engineering-platform.system-provisioner/v1"}}],"composition_id":"ep-only-2.3.113","host_requirements":{"backup_reserve_bytes":2147483648,"minimum_available_disk_bytes":8589934592,"minimum_macos_version":"26.0.0","minimum_memory_bytes":8589934592,"requires_administrator":true,"requires_network":true,"requires_trusted_clock":true,"supported_architectures":["arm64"]},"managed_tools":[{"digest":"sha256:e862168c8153db469ae4e0ab3dccd7af31bd281e2b9b9dd45e1e5c7d069ad5ac","identity":"git","url":"https://autonomous-engineering-system.github.io/forge-platform/managed-tools/v1/git-2.56.0-arm64/forge-platform-managed-git.tar.gz","version":"2.56.0"}],"product_venvs":[{"component_identity":"engineering-platform-server","python_runtime_identity":"sha256:519d7975f16e78f808403188b3a8417bab10af000208ef1ec82c42bccfa94ceb","venv_identity":"engineering-platform-server-primary"}],"providers":[{"credential_scope":"component","identity":"codex","minimum_version":"0.157.1","owner_component":"engineering-platform-server","required":true,"runtime":{"archive_kind":"tar.gz","artifact":{"digest":"sha256:a096caeec7ca0f29c6fe0e3389d34d5c0f8be01cd9291f983a54439a2a63d7ee","url":"https://autonomous-engineering-system.github.io/forge-platform/provider-runtimes/v1/codex-0.157.1-arm64/forge-platform-provider-codex-0.157.1-arm64.tar.gz"},"executable_digest":"sha256:27ceb5f9b957b43a519efe4eaa3816a0bffb0a531a2c89af18840c0a3c016a7d","executable_relative_path":"bin/codex","version":"0.157.1"},"target_identity":"selected-deployment"},{"credential_scope":"component","identity":"github-cli","minimum_version":"2.101.0","owner_component":"engineering-platform-server","required":true,"runtime":{"archive_kind":"tar.gz","artifact":{"digest":"sha256:493e6fa64f918810ee057fcab446a0006989a92dd3edbf2802ab13d3da9e1cc0","url":"https://autonomous-engineering-system.github.io/forge-platform/provider-runtimes/v1/github-cli-2.101.0-arm64/forge-platform-provider-gh-2.101.0-arm64.tar.gz"},"executable_digest":"sha256:aa97dfb4a82f7c56063cdcbfaa39a738b923c1bdca29bd5a041b8e959ca38e04","executable_relative_path":"bin/gh","version":"2.101.0"},"target_identity":"selected-deployment"}],"python_runtime":{"abi_tag":"cp314","architecture":"arm64","artifact":{"digest":"sha256:4490ab17e58008a4c6c52fc36590ae5f88b2800f1db25236ef2288dc591832f6","url":"https://autonomous-engineering-system.github.io/forge-platform/managed-tools/v1/python-3.14.7-arm64/forge-platform-managed-python-runtime.tar.gz"},"artifact_kind":"forge-platform-managed-python-runtime-archive-v1","build_provenance":{"digest":"sha256:84245721dc4989a595074eb6202d4d2b30d414921ced48908d3ec926389515fa","url":"https://autonomous-engineering-system.github.io/forge-platform/managed-tools/v1/python-3.14.7-arm64/build-provenance.json"},"build_variant":"standard-gil","identity_digest":"sha256:519d7975f16e78f808403188b3a8417bab10af000208ef1ec82c42bccfa94ceb","implementation":"cpython","managed_root_identity":"forge-platform-managed-python-v1","minimum_macos_version":"26.0.0","operating_system":"macos","platform_tag":"macosx_26_0_arm64","policy_revision":"managed-tools/v1","python_tag":"cp314","schema":"forge-platform.managed-python-runtime/v1","source":{"digest":"sha256:62859805f6fdf25e2bcbf3fa3217801e1996887ca33e6a2af80674bdfa2dbe07","url":"https://autonomous-engineering-system.github.io/forge-platform/managed-tools/v1/python-3.14.7-arm64/cpython-3.14.7-source.tar.gz"},"source_provenance":{"digest":"sha256:9b5a3fffb6fb926687370b00c3e0d0788f0eefb27c8a4413255e3d2c489aabfc","url":"https://autonomous-engineering-system.github.io/forge-platform/managed-tools/v1/python-3.14.7-arm64/source-provenance.json"},"version":"3.14.7"},"requires_installer":{"capabilities":["catalog-component-set/v1","composition/v3","managed-deployment/v1","managed-python-runtime/v1","provider-fanout/v1","provider-gate/v1","provider-targets/v1","system-launchdaemon/v1"],"minimum_version":"0.4.30"},"schema":"forge-platform.composition/v3","upgrade_from":[]}